{
  "id": "AIA-WAIT",
  "name": "Wait",
  "node_type": "action",
  "status": "active",
  "data_version": "1.0.0",
  "description": "Terminal action.",
  "tags": [
    "action"
  ],
  "evaluator": "action.wait",
  "ports": {
    "inputs": [
      {
        "id": "in",
        "kind": "flow",
        "data_type": "flow"
      }
    ],
    "outputs": []
  },
  "parameter_schema": {
    "type": "object",
    "required": [],
    "properties": {},
    "additionalProperties": false
  }
}
